[
  {
    "evidence_id": "EER-000001",
    "claim_id": "ECR-000018",
    "evidence_type": "field_observation",
    "direction": "supporting",
    "source_ids": ["EOR-000001"],
    "strength": 0.76,
    "quality_score": 0.86,
    "provenance": {
      "pipeline_version": "0.1.0",
      "created_at": "2026-09-27T00:00:00Z",
      "source_provider": "gbif",
      "source_identifier": "fixture-1",
      "transformation_steps": ["normalize_observation", "link_to_claim"],
      "quality_flags": []
    }
  },
  {
    "evidence_id": "EER-000002",
    "claim_id": "ECR-000018",
    "evidence_type": "field_observation",
    "direction": "contradicting",
    "source_ids": ["EOR-000002"],
    "strength": 0.42,
    "quality_score": 0.82,
    "provenance": {
      "pipeline_version": "0.1.0",
      "created_at": "2026-09-27T00:00:00Z",
      "source_provider": "gbif",
      "source_identifier": "fixture-2",
      "transformation_steps": ["normalize_observation", "link_to_claim"],
      "quality_flags": ["sampling_effort_shift"]
    }
  },
  {
    "evidence_id": "EER-000003",
    "claim_id": "ECR-000018",
    "evidence_type": "field_observation",
    "direction": "contradicting",
    "source_ids": ["EOR-000003"],
    "strength": 0.38,
    "quality_score": 0.78,
    "provenance": {
      "pipeline_version": "0.1.0",
      "created_at": "2026-09-27T00:00:00Z",
      "source_provider": "inaturalist",
      "source_identifier": "fixture-3",
      "transformation_steps": ["normalize_observation", "link_to_claim"],
      "quality_flags": ["public_reporting_bias_possible"]
    }
  }
]

